text,emotion
i got into a tight pair of trousers and examined myself in the mirror  my back looked unpresentable and i felt ashamed at my wanting to wear those clothes that day  i quickly changed into another dress,shame
"i wanted to go to bhopal for relief work (gas tragedy)  my boss simply refused to let me go, i was so angry that the only thought that came to my mind was to quit the job",anger
when i learned that a relative had been spreading rumours about me,disgust
finding out about the university does not have enough foreign currency to buy the yournals in your reference list,sadness
the passing away of my mum,sadness
fighting with class mates in highschool,fear
when coming up for trial because of shop lifting,shame
when my room-mate locked up the keys of my room in our room after i had told her that i was  only in the bathroom having a shower  she left and i had to do without supper,anger
"after getting a fail notice for a math class, i realized i was not doing very well in school in any subject i began to fear failing a class or two",fear
i found a big black beetle in my coffee cup it was alive big and it was moving its limbs,disgust
i have a very big family at my grandmother's funeral we all met and everybody pretended mourning in reality it was like a fashion-show: everybody wanted to show himself,anger
a woman i know is slowly dying from cancer observing this process makes me sad,sadness
"when i saw a big man hit another one, and nobody did anything",anger
when we got a young dog,joy
when i was admitted to the bulgarian state conservatoire,joy
when i was attacked by a teenage boy and had my wallet stolen,fear
"when i get something that seemed very hard like getting a job, a boyfriend, etc a specific sutuations, was when i started to date a boy whom i liked for a long time",joy
when i was reprimanded by the manager of the hotel where i worked during autumn 1984,fear
"the way my husband and his family treated me - unfairly, cruelly, and unjustly",disgust
after moving out of my apt i took all the furniture and dishes and everything it was mine but i took it all just to spite my roomies we had a few (a lot) of disagreements i felt guilt for moving out for the bad reasons,guilt
"i put on a lot of weight in a few months and every time i met someone i knew would avoid them, usually by hiding because my self image was low and i was ashamed of what i had done to myself",shame
"i spend the night with my boyfriend, while there was also a friend of his we all lay on the floor to sleep when my boyfriend was fallen asleep the other boy and i started petting after 15 minutes i felt miserable and awoke my boyfriend to tell á",guilt
i had shouted at my younger brother and he was always afraid when i called out loudly,guilt
when a friend who comes visiting me unexpectedly asks for coffee and i refuse to give him this,anger
when i did something naughty and it lead to the embarrassment of my parents,shame
"the time when i cleaned the house and everything was tidy, then my cousin, who is 4 years old, came with a muddy pot and made a mess of the whole thing",disgust
when i was selected to come here,joy
"by fun i had a tussle with my sister suddenly i obviously hurt her unintentionally - and she ran out of the room, crying",guilt
i was awakened by a dream in the middle of the night i dreamt that a stranger was in my house,fear
my boyfriend returned after a long absence,joy
when i forgot a promise made to a friend of mine,shame
"fear - paralysing - that i would not be accepted by the god who i believed to be there because i was ""morally bankrupt"" (before becoming a christian and realising that that was why christ came to free us from sin and to forgive us)",fear
"there is one thing which makes me feel shameful,  when i see friends of my age group working and earning a lot, when i am still studying  a friend i met a week ago after a period of 5 years is earning more than rs 3000/ month",shame
when i heard my sister got in a bad car accident,sadness
"when i was 12 years old, some friends of our family had come to watch tv i lay on the floor and moved my pelvis when the other people had gone, my mother told me that it had looked as if i had wanted to make sex",shame
"i had a very heavy work load and two colleagues, whom i have nothing against, disturbed me by ""terror ringing"", ie continously interrupting me by telephoning",anger
i was unfaithful to my partner once when he was working abroad for a long period,guilt
"when i saw russian roulette on tv (obviously the movie ""deer hunter"")",fear
a close married friend has just had his first child,joy
when i passed the first year and so i could come back for my second year,joy
"in the tram there was a fat, sickly looking woman in front of me who was asking for directions in a thick voice  when she got up to go a disgusting smell of urine came from her  i felt that i would choke",disgust
i was reading in the paper the feature on henry lucas who claims to have killed 380 people he was a recreational killer and a necrophiliac and zoophiliac he has raped and beaten many women and killed men too,disgust
"on the occasion of assignment of tasks and responsibilities in which such an assignment, dispropotionately carried with it high responsibility and low ability of organisation and resolution",anger
a bad smelling cucumber,disgust
from the fact that my husband and i are not in good terms,sadness
"after my shoulder operation, i woke up in the hospital room alone i was in pain and was still under heavy medications i could not find my parents",fear
"i took some money from my parent's house without asking them for it, and i was caught red handed",guilt
one day i did not feel very well and i wanted to talk to somebody a friend invited me for dinner and i was very glad,joy
"i felt very sad when i was in form three to notice that my friend barley jumbe, had lost very expensive new sports short trousers",sadness
"my boyfriend hinted over the phone about wanting to ""be free""  he thus did not say it point blank, silence followed",fear
when i became aware that an acquaintance had stolen from friends,disgust
a few days back a friend of mine had asked me to call on him on sunday  i had accepted it but later did not go for no specific   reason  i just slept in my room  the next day this friend called  me up and told me that he had been expecting me the,guilt
"when a kid dropped my father's radio cassette player, which he had just repaired",anger
after having quarelled with a relative of mine about politics,anger
when i had not done well in geography at my mce i was expected to get more than i did,shame
during the physics experiment session i did not understand the content of the experiment and did not know how to do it,sadness
"once again, my life partner came back home drunk at midnight",disgust
when i found out that i could not go to the concert (after buying the tickets) because of a biology test which occurred the morning after,sadness
"i deliberately avoided a person who i wanted to hurt, and who wanted to talk to me",disgust
"one fears many things, for example one fears going to the dentist but as far as i am concerned this feeling is connected with the examination session",fear
some times i was ashamed of presenting seminaries or even to speak in class,shame
"having failed to help with the 5th of march arrangements (women's day), although i had previously promised to take part in the work",guilt
"i was on my way back from the inter rail, on board the ferry from stockholm when my father called me at 7 o'clock to tell me that my uncle had died and that i would be seeing him off on his final journey within four days",sadness
when they stole my dark blue tennis,anger
"when my boyfriend was changing his behavior there was something wrong, i felt sad, because it's desagreable when a relationship is ending",sadness
confronted outside a party by some very nasty character - gesturing to a car full of mean-acting friends - felt in danger,fear
"i promised my mother to come home on her birthday, but at last i was prevented nevertheless it would have been possible to go but i did not",guilt
i feel sad when somebody is unjust to me,sadness
"my boyfriend with whom i had a longlasting relationship, fell in love with another girl, then he asked me something which implied that he loved that girl more than he loved me",sadness
"a certain boy came into my room and started telling me that i was not pretty, that i had no manners and that i should learn some  i had just come to campus and he was in fourth year",anger
"now that the 49ers are winners, the fans are coming out of the woodwork and jumping on the bandwagon and that disgusts me",disgust
"when i was in the army, a room mate of mine came back from furlough and threatened another fellow with a knife",fear
in summer when i was sailing with friends in greece i felt joy,joy
"a relative, whom i like very much, left for the united states",sadness
when i was in the puberty i smashed the favourite toy of my little brother because of a fit of rage,guilt
i lost a conference because i hadn't got in touch with a certain person to inform her that i would go with her i thought she knew what i wanted,guilt
was nearly knocked down by a car,fear
"i was in ""hainburg"" in december and i was angry about the politicians and the police",anger
when i was teaching a student started making silly remarks in class,disgust
"when i realized that i had been wrong about a person close to me, because of pre-set ideas and prejudices",shame
"when i talked to another student about the notes she got last semester, not knowing that she got a lot of bad grades",guilt
fearing the use of power or reprimands when i belong to the minority,fear
"when i tried to explain to a plumber, face to face, that the toilet was broken and he did not believe it (it had been mended ten times)",anger
meddlesomeness of my mother about the way i live she thinks i am to free in my behavior for instance when a boyfriend stays the night,anger
i saw a skid-row (chronical) alcoholic and i was ashamed of the people with a high standard of living,shame
when i did not concentrate on my studies despite my mother's help and cooperation,guilt
my grandmother died suddenly last summer,sadness
when in my childhood we were forced to take cod-liver oil,disgust
"when a lady i was flirting with told all my class-mates that she was in second year while i was in first year, everyone laughed and started looking at me",shame
"i had obviously done the work badly but my class-mates of the student's association did not blame me, they helped me do the work",shame
when something went wrong for me i lashed out at someone else whom i loved and who was not in any way responsible for what had happened (my sister),guilt
i experience feelings of guilt because i do not study enough,guilt
"i had to have my tonsils out i had been making up my mind almost for a year - i was afraid but during the two hours in the hospital room, while i was waiting to be called for the operation i felt a real fear - of the pain, of what they were going",fear
i passed on some gossip that was untrue and cause two friends to have a fight who were already experiencing difficulties with each other,shame
a sense of guilt before my parents when i had to discountinue my studies in the first year because of unpassed exams,guilt
i was inside the car with my husband and we were assaulted with a gun at 10 o'clock in the evening,fear
when i got fired from a job because i gave a discount to a friend,guilt
i passed successfully the preliminary exam for a participation in the children assembly,joy
"a member of a religious sect tried to convert me, using really evil tricks to persuade me  after he had left, i was anxious and angry for a long time after the event, i was alone",anger
when my first sexual intercourse turned out to be a flop  i was in a panic and ended up without an erection,shame
the first time i really fell in love with a girl,joy
on my way to a concert i went with a man who tried to molest me at that moment i did not care much but now the impression fills me with disgust,disgust
my father suddenly fell ill and died,sadness
"when somebody i knew greeted me and started to talk with me and i didn't know, i couldn't remember who he was",shame
once i arrived two hours late to my work place (a bank) and i was still feeling feeble and tired,shame
fear of thief,fear
it happens sometimes in connection with certain persons with whom i have frequent relationships but nothing special,guilt
a neighbour complained about smoke from my backyard incinerator entering his house after a change of wind direction i lit the fire after originally checking that the wind would not blow the smoke in that direction,guilt
when i was told that the brother who was staying with me would not go to the training school that year but only the year after,disgust
"coming to this lecture and listen to you talking about feelings, i am so happy that foreigners have the same feelings as chinese",joy
"i felt very sad when my boyfriend wanted to break our relationship our relationship lasted two years, we shared everything and all this was finished",sadness
when india first won the world cup cricket tournament,joy
my parents told me that they do not like my friend,sadness
when i saw someone eating live worms,disgust
"when my aunt, whom i had loved very much, died when i heard about her death, i was not as touched as at the funeral i really became conscious of her death at that moment",sadness
"when i went to a job interview, i met a person who was very nice, and his attitude made me glad",joy
"when i was doing my last year at secondary school i was robbed of my clothes, wristwatch and my pair of shoes after investigations it was found that all the things were stolen by one of the boys in our hostel",anger
on the way down a ski slope which was difficult and steep,fear
"i was to meet a girl in a discotheque  she was very pretty and i was very happy  but she did not turn up  thank god, there were some other friends there and i was able to have a more or less good time",sadness
i was at home alone and my mother had asked me to heat the house i put too much fuel into the stove it began to glow and there was a noise in the whole house as if it was going to explode,fear
cannot remember such a situation,shame
"a few months back i had gone to my friend's place and they offered me tea and coffee  i do not have the habit of drinking tea or coffee and so they offered me a glass of milk instead, so i felt ashamed",shame
"i could not take care of my mother when she was admitted to a hospital  for surgery, i continued my studies as i could not get leave",guilt
"i saw a movie called ""the thing"", the film directed by john carpenter  the monster in the film made me feel disgusted",disgust
saw my father with that woman he is married to now,disgust
some days ago i had a slight car accident through my fault,guilt
when i bought new skis; i was ashamed to tell the assistant that i am not good at skiing and therefor bought racing skis,shame
i had borrowed some money and i exceeded the time-limit,shame
i had worked long and hard on a project when a friend inadvertantly destroyed it i could not forgive him for a long time and at times still get angry at him,anger
i asked a girl out on a date and she said no,sadness
"one evening when my sisters, brothers and i were watching tv my kid brother took a big mirror and reflected light on the french windows  i thought that these lights that we could see were coming from torches annd that it meant that there were thie",fear
when my gradmother died  i felt very sad then  the feeling started to be worse after a while,sadness
when my boyfriend asked me to go out with him and i refused because i wanted to go out with another guy  i did go out and my boyfriend found out,guilt
i was angry this morning when i missed the train to university,anger
at work being shifted to another area,anger
when a close friend of mine who was with me in first year could not make it to the second year,sadness
"getting my kitten, found at work several years ago, taking him home in a box on my motorbike, showing it to my defacto",joy
i was angry when somebody stole my half petticoat,anger
this monday i took a math 1bs test and flunked for the second time,sadness
towards wife's laziness in not performing her usual duties because of television watching,anger
"when the teacher asked me a question in class, concerning something i had read earlier, and i did not know the answer, so i felt ashamed in front of the whole class",shame
i ran over my dog with a bicycle when i was carrying him tied to the handle bar,guilt
watching a tv documentary on seal clubbing,disgust
"the day that there was a black-out in the city, and i was in an exposition, i felt fear that something more serious was happening, like a revolution for example",fear
when my 2 year old son climbed up and sat on the 7th floor balcony with his legs hanging out  he was holding on tightly to the upper railing of the balcony but he could have easily lost his balance when he sat down,fear
at a party where the boys were telling revolting stories about the girls they'd been with,disgust
i was using my sister's stereo while everyone was out i know she wouldn't want me to and i would get into trouble if she found out but she was only partly justified in forbidding me to use it she never found out,guilt
i wrote an exam and happened to have not done as well as i thought i would i was angry to myself for not having done so well,anger
i saw a program on tv where they had to saw a skull for an        operation,disgust
we were riding in a friend's car  he was driving very fast and suddenly a another car crossed the road in front of us  my friend had to turn the car rapidly,fear
"when i was late for work and told my boss that it was due to transport problem, whereas the truth was that i had woken up late  i thus cheated my boss",guilt
when i dated my friend's boyfriend after they had broken up,shame
insulted by some stupid people,anger
failed in a piblic argument,shame
"i felt disgust about all my friends after having done a great effort to organize an evening together, and didn't work out, they put the blame on me after this, i feel disgust towards those that blame me",disgust
"when mother was very ill, i feared that she would die",fear
one day i was angry with my friend who went into my drawer and took a piece of paper on which i wanted to write a letter and used it for her business without my knowledge,anger
"when a friend of mine was drawn into a fight because of the stupid gang he belonged to i felt angry with him and his friends they could not think about anything sensible, but would fool around without taking into consideration the feelings of ot",anger
"i came home from a discotheque at half past four in the morning, although i had promised my parents to come home at midnight from 3 am i felt guilty towards my parents",guilt
my mother along with some of my friends gave me a surprise birthday party - they invited a large number of my friends along too,joy
"one day my room-mate started imitating me, doing what i had done a few hours back  i got very angry and started beating him up",anger
"when i was about to write my junior certificate exams, i received sad news telling me that my elder sister had passed away",sadness
"spoilt, smashed and molded potatoes in the fridge, and having to clean up the dish later",disgust
when i heard that i had passed the second year exams,joy
the male friend of my mother (a widow) moved in to live with us  i did not like the man,disgust
when i was given detention at secondary school,shame
"when one finds out that someone you know is not at all like one had thought, for instance friends who steal and things like that, quite unwarranted",disgust
because of the examination i had to study night and day,disgust
i had just masterbated with another boy,shame
"when i used an adjective for a person without knowing what it meant   when i got to know the meaning, i felt guilty as it was a clear and unfair insult",guilt
not being chosen for the english lectures (my girl-friend chosen),sadness
"a patient, to whom i had given a powerful medicine, shouted at me in front of many people  i realized that he did so because he was very ill",shame
selling my used car,joy
because of a conflict with my parents there was a possibility to interrupt my studies,fear
when my girlfriend became pregnant,joy
my grandmother died,sadness
"this was when the girl i was in love with accepted my proposal and everything went smoothly, just as i had wanted it to  it was contrary to my previous feelings of uncertainty about her response",joy
"when i found a maggot in my food at the dinning hall, all the food had gone bad",disgust
i told a friend that i was going to a party and he would not enjoy himself if he came along  he understood  that he would not have fitted in and there was something in that,shame
"when i dived among sharks and the brightly coloured fish on the outer reef of tvavni, fidgi",joy
my current lover and i had been very busy with work and study and had not had time alone together for almost a month until one afternoon recently when we made love for hours and then showered and ate together,joy
doing this pointless questionnaire,disgust
i received an unexpected letter from a friend i had met a short time before  he sent me a poem and wished me good luck  i felt very happy because i had great esteem for that person,joy
i experienced this when my maternal grandmother passed away  she was the last of my grand parents to pass away,sadness
my sister and brother in law returned from sri lanka where they adopted a child i went to pick them up at the airport,joy
losing my temper and allowing myself to act childishly by yelling and screaming at a person who i felt had done me wrong - in effect lowering myself to their level,shame
"when i think about my family (parents, brothers, sisters) guilt is a part of my feelings",guilt
at the death of my husband's father's mother which occurred during university examinations and therefore i was unable to attend her funeral,sadness
when i feigned sick leave from work,guilt
when my brother hit his head and lost consciousness at the sports practice  for some time he could not remember what had happened but he recovered later,fear
i borrowed $ 2000 from a friend and paid him back much later than i had originally intended,shame
"one night i could not practise my violin as my family was watching tv with the lights off, so i wanted to listen to some tapes  it was dark so i asked my brother to bring me a torch, however he scolded me  i was so angry that i slammed my violin",anger
caught cheating on a diet,shame
"i was spending a few days at my aunt's place  one night i got home very late, i had told them i was going to a party but i went to another place  they were very worried",guilt
when someone took my writing materials yet i was to write examinations in a few minutes,anger
when i broke my leg i felt fear,fear
i failed an exam which i thought i would certainly pass,shame
"my sister in law was about to have a child, and there were some problems  they had to do a caesarean  after a while, everything  was all right",joy
a child told me she had been sexually abused by her step-father i only knew the child and had not come into contact with either parent i tried to do what was best for the child the event and the stepfather disgusted me,disgust
i get angry when people disbelieve me or misunderstand me,anger
when i was bluffing in front of my mother to get more money,guilt
i was really disgusted when i saw one of my friends soiling on his clothes i thought he was mad,disgust
when i found my girl in bed with another man,disgust
the time i qualified to enter secondary school,joy
such a feeling springs up in me sometimes when i have meals at a catering establishment it is a result either of the look of the food or when watching the way some people eat,disgust
i went to a friend's baptism as she became a christian after me and i realized that she was more enthusiastic about her spiritual life than i was  when i was with my brothers and sisters of christ i had a guilty feeling which could not be dismissed,guilt
"after an exam i was in a very bad mood as i had done it very       badly  at home, my mother took so long to ask me how things had  gone that i lost my temper  i overreacted and made my mother cry she still prepared lunch for me and did not scold",guilt
"when my friend failed an exam by just one mark  during this exam she had asked me to show her my answer sheet and i had not done it  when the results came out, i thought that had i shown her my answer sheet she would have passed the exam  i felt",guilt
i caught a glimpse of a black-beetle,disgust
death of a pet rabbit we had to give it away because my brother became allergic to it we gave it to a man who kept animals and lots of other animals for children to watch we went to visit our rabbit it was badly beaten by the other rabbits and e,sadness
seeing a person panhandling money on telegraph,disgust
"when my grandmother passed away  we had been waiting for it as she had been sick for years, but when it happened i found it hard to accept",sadness
when someone told a secret i told them not to tell,anger
helping older people on the toilet,disgust
when my grandmother died,sadness
"my friend had written a letter to me, the contents of which i misunderstood and i wrote back a very harsh letter to her  on realizing the blunder i had made, i felt like hiding my face in the sand",guilt
"i had a driver licence but i didn't drive for a long time, than i started to drive again, and had to get into hard transit and highways",fear
at the moment when i heard the result of an examination and it proved that i succeeded the second year of my study,joy
my girl-friend left me,sadness
