text,emotion
having passed the exam required to be an authorized radio/tv dealer,joy
when a thief broke into my house at night,fear
when i lied last week i lied to someone to get info for a paper i was writing i told her that the info was for a newspaper article i was afraid if i told the truth she wouldn't help me,guilt
"my brother came to tell me about some problems we had in the  family  i felt sad because i thought that if my mother had not gone away when this brother was younger, things would have been different",sadness
my uncle was taken to the utc for an operation as he had cancer  there had been a lot of deaths of late - 3 out of every 4 operated  i was scared for my uncle's life,fear
when i finished the work that i had planned to do - my homework,joy
"when i was 9 years old, i got a cat, but after 3 days he died i was very sad, because i had nursed him and taken him to the veterinary's - but in vain although i had had him only for a short time i had liked him very much",sadness
"i lost my grandfather whom i loved very much  i had not known that he had been ill for a very time, when i received this message he was already dead",sadness
ctiticized by teachers in public,shame
watching a horror film,fear
"i was feeling really low - had been a series of fights with my siblings, been under pressure at school and wasn't going to the party i wanted to go - instead i was going out with my family a guy called and said, in effect, that i was ""nice"" and he",joy
one of my fellow students used questionable and unfair means to advance her studies faster than others  i detested her,disgust
i lost my temper at my mother while she was teaching me  i felt ashamed and sorry at having hurt my loving mother,shame
"when i tried to breake it up with my boyfriend, and he refused to let me go",anger
when my friends and i were caught with our girlfriends outside the school grounds when i was at the secondary school  we were caught by the headmaster,guilt
"the same event described under ""shame""",guilt
emotional reassurances by spouse,joy
"i was seven years old and swimming outside the flags at the gold coast i was caught in a rip and taken out about 100 m i couldn't swim too well, but an older friend (17) swam out and saved me",fear
parents finding out i smoked,shame
having moved into a flat within the last week i felt some disgust that a bathroom tap had been left to drip with a faulty fawcet,disgust
when my relatives troubled me so that i would help them financially,disgust
two-timing - going out with person other than guy i was in relationship with,guilt
when my boyfriend almost had a relationship with a close friend of mine,sadness
when i attended the concert of a pop singer,joy
when i was about 17 years old and i stole some pens from a stationery store because i didn't have enough money,guilt
when i drove to stockholm for the first time and drove off the stora hissingen road at the wrong exit,fear
some time ago a girl tried to make me up without any action of my part she used all possible means although i behaved refusingly she did not give up for a longer time,disgust
my grandmother died,sadness
someone told me we are not as good as the all english class,anger
"when my roommate's boyfriend assaulted me he was threatening me, calling me names and pushing me around",anger
hearing norman jones get hysterical in parliament about law reform (on the radio - listening with 2 others),disgust
"when i came for the lesson, it was cancelled and i had to fill in a questionnaire instead",anger
saw two canadian students boasting about how rich they are in canada,disgust
"at my job, i got disproportionately angry with a child  my reaction was not as it should have been",guilt
long illness,sadness
"when i saw my brother in church, and publically accept jesus christ as his saviour and lord",joy
"my notes were not returned to me, it kept on being procrastinated",disgust
being threatened by another person,fear
"during a class i was asked a question which i did not hear very clearly, so i gave an answer which was not related to the question and everyone started laughing at me",shame
the death of my mother-in-law after a long sick-bed at the moment of dying i was with her,sadness
was caught stealing apples in a neighbor's garden,shame
when out of work,sadness
"one year, when i went to a camp, i was chased by a dog  i tried hard and finally managed to escape from it  my torch suddenly went off and we talked about ghost stories and i thought that there were ghosts",fear
"went to a movie with a date, walked on the beach (in alameda) spent some time afterwards in her apt",joy
"when i heard about the way a parent of a friend had mistreated him, and caused a great instability",disgust
this happens to me when i am not prepared in a given subject,shame
"i entered the hostel this year  my mother was ill and could not move and needed people to look after her  every week i left home to go back to school, i felt guilty",guilt
i was sitting in a restaurant with friends and i knew that in the meantime my girl-friend must have come to my flat and found the door closed,guilt
this last august when my parents dropped me off and moved me into college i didn't know anybody here; i was 17 and berkeley really scared me,fear
"on reberbahn, i was in a ""restaurant"" where drinks were overpriced  i did not ask for the prices beforehand, and when the bill came i could not pay the bill",guilt
the first time that i had to go up on the stage to give a speech,shame
fooling around with this guy i did not know,shame
it was when i injured a friend accidentally with a stone it made a cut on the cheeks which resulted in suturing,guilt
when i asked a friend to return the money that i had loaned her and then remembered that she had repayed me in several ways,shame
"once after falling in love, i imagined that particular girl to be perfect and completely overshadowing my girlfriend afterwards i realized that this image was not objective i felt guilty against both girls",guilt
"when i had to give a speech about some historical event, to an audiece of about 200 people my own age whom i did not know",fear
going out alone in the dark,fear
"my sister had to undergo a very complicated operation, her eyesight was at stake",fear
when i saw an insect going up my arm,disgust
i had to leave my girlfriend for 4 weeks because of my studies this happens frequently the last 24 hours before my departure are always very depressing,sadness
"unfair and unjust attitude toward a person close to me, what i was the witness of, caused anger in me",anger
"while watching tv (a war movie), i felt a strong fear of death, threat and fear of loosing people close to me",fear
"i asked my friend to come with me to a disco because i wanted to be with a person i know well but when i amused myself with others i let my friend sit alone, although i had asked her to come",shame
"there have been very few instances of disgust, as far as i can remember they are not important or worth mentioning",disgust
"a couple of years ago during the summer holiday, i was fishing at a lake with my husband  suddenly it started raining while the sun was still shining i experienced a feeling of joy, happiness and fulfillment  the whole nature was full of music",joy
when i was afraid to tell my sports teacher at secondary school that i had not participated in the sports activities the previous day,guilt
lost a friend,sadness
before the declaration of the ssc results,fear
while watching an entertainment program in which there was a clever  and amusing sketch,joy
i was saying bad things about a man i had never seen  i was with a friend and did not know that she was related to this man  my friend did not tell me about it and i discovered this myself,shame
renewed contact with an earlier friend,joy
that was what i felt when i told my first lie and then was cought,shame
"viewing the nuclear war film ""threads""",disgust
when the result of the certificate exam was announced  i was surprised and happy as the result was better than i had expected,joy
when i got the positive result of my examination to achieve the bachelor degree in plychology,joy
when i attended my cousin's 31st birthday,joy
a parking fine,guilt
i was a prefect at secondary school  on the sports day i told others that i would take down the names of the people who misbehaved and after some time i sat down for a brief rest  suddenly the head prefect came and scolded me in front of others á,anger
"after seeing an ""uncertain"" child work on a model for several hours, i watched a ""bully"" of the same age destroy it, telling the child that it was worthless",anger
the weather is very bad (fog and slipperiness) the newcast reports many traffic accidents and my boyfriend is driving home and still has 60 kilometers to go,fear
"this occurred when my girlfriend and i have to finish our relationship due to some circumstances between her and her family i was really sad, hurt and couldn't really find any reason why am i still living is this life is all about ? this was one",sadness
when i was going to take the practical exams,fear
i was walking to my car at night and thought that i was being followed,fear
"when we stayed in vienna with our class, my friend and i behaved incorrectly our teacher threatened us with exclusion from school",fear
a few weeks back my daughter had very high fever and i was scared that it might lead to brain damage or convulsions,fear
i felt it when playing i pushed my brother and he fell down cutting himself in pieces of tile,guilt
at rejection / being ignored by a loved person held in great esteem,sadness
"one evening, i was with a group of friends having a talk  there was a very trustful and joyful atmosphere",joy
at a party my best girlfriend got really drunk and went off with a guy she knows i really like,disgust
one night a friend found out that i dumped one girl for another and he proceded to lecture me,shame
"my nephew is a deaf and also ""hyperactive"" boy i had been responsible for looking after him for a full day, and was very tired then he suddenly grabbed a knife and stabbed me in the leg i got so angry that i didn't feel any pain",anger
when males in my family try to assign house duties exclusively with referance to sex,anger
"the week before i entered to army, when we were being selected during 5 days i had to pass 10 hours a day waiting for the answer, which at last was the worst the fear of being convoked, of hearing the fated phrase, was constant",fear
"when, for example, someone is calumnating",disgust
i was driving and stopped at a stop light i was planning to make a right turn as soon as it was clear it was clear on the left so i started but a man was just in front of the car,fear
my parents do not like my friend and told me to stay away from him,anger
when i do something unworthy,shame
"at end of school - function to ""celebrate"" ? leaving friends who i'd known for up to 12 years",sadness
when i heard that i had passed primary school leaving certificate and was selected to go for secondary education,joy
getting a low grade on my physics midterm,disgust
insulted by somebody,shame
"i was at a children's camp abroad the people (the leaders, my coevals) were very king to us one night we smeared our foreign friends with tooth-paste while they were sleeping and then we roused the whole camp by our shouts later i was so sorry i",shame
when i went home on holidays i found that my niece and nephew had passed away i was very sad for the children were not even sick before death but suddenly died,sadness
"while watching the movie called ""deer hunter"" on tv, when it showed how prisoners were treated",disgust
"my mother was ill and asked me to prpare our lunch i went to do it, and while i was working, she stayed behind me telling what i had, or not to do i asked her to stop meddling, and to go to bed when i went to ask for help to my sister, my mother",anger
when my aunt passed away in early 1982,sadness
"i felt guilty when i spent a night at my boyfriend's place, particularly because i had been harsh and spiteful when i had left home  the reason was that i feared a possible discussion on the subject and i wanted to leave defiantly",guilt
when my girlfriend told me that she was no longer interested in me,disgust
stealing money from my parents when i was young,shame
a  group of youngsters dressed in fads talked foul language on a bus  they also insulted the  pedestrians on the road and were impolite to the passengers of the bus,disgust
being driven by friend who suddenly swerved and skidded a little it was night and on a long trip we ended up on side of road,fear
fear of the turn that the examination paper would take as i lacked confidence,fear
"during our last exarcise in agricultural machines we went out in the yard to examine a row of machines but we seemed not to have fulfilled our task well, because when our teacher came and asked me a question i was unable to answer i felt awkward b",shame
when i failed the grade seven examination,sadness
lack of respect for my parents,guilt
"i was involved in a  attempt on a man i had developed a close warming relationship with although i knew i had done everything i could and that his progress of a ""normal"" life was poor i felt guilty as if i could have done more",guilt
when i heard that my father had passed away i could not eat for a week and was only crying i could not find the courage to go to bath,sadness
the day i heard that i passed the high school exam,joy
i got an a in anatomy - the first one i have ever gotten in a science class here,joy
when a thief broke into my house and stole some valuable goods,anger
when i was ditched by my girlfriend,sadness
when i failed my primary school leaving examinations i never thought i would fail when i heard i had failed i really felt ashamed of myself,shame
after having taken an exam i feared having failed it,fear
i made an appointment to pick up someone however i arrived too late and she had to wait a quarter of an hour,guilt
"i was working as a secretary  my boss was to go to give a lecture, and wanted me to give him the exact address of the place",guilt
i saw a magazine with photographs of dead and maimed people whose limbs were separated from their body like a head on one side and the leg on the other,disgust
when i lost the person who meant the most to me,sadness
"when i was about six years old, i mistook a cat for a leopard      when it entered my room at night",fear
"our tutorial group was soon to be divided, and we got a list of names of freshmen, out of which five were to be in my group  we read the names and then each group went its own way to a seminar room  i wondered how i would cope with the new situati",fear
i felt ashamed when i was confronted by a teaching assistant that a close friend and i were accused of cheating on a math exam,shame
we are repainting rooms in my house my mother started to enact plans to paint my room without consulting me,anger
when my oldest sister discovered that her boyfriend had another girl,disgust
"on a social occasion, i noticed that i reacted on the basis of my autonomous nerve system (i could not help it)",shame
mugged while on holiday in the usa,fear
"in the past i experienced this feeling almost all the time - wherever i went, in different sutuations i was small and i had to be taken to kindergarten, but me the fool didn't dare to tell exactly where, finally as a result i was late",shame
"i borrowed a car which was supposed to be used for a long journey a few hours later, and one of the tyres burst in the middle of the town and i did not know what to do",fear
i had an argument with my boyfriend  it was my fault but my pride would not let me admit it,guilt
i am afraid before an exam or colloquium,fear
disgust with myself for consistently making foolish errors in communicating with others (asking for 1/2 kg of nuts when i only wanted 50 g),disgust
"i had been having a heated argument with a lover - whose intention was that we should marry in the near future - and was rejected by her when i started to cry when i stopped crying for a moment she said ""there, have you got it all out now ?""",anger
"i destroyed my step-brother's bedsheets by mistake, they were the only ones he had",guilt
i felt guilty when i once went out with another boy and made love with him while i had a close boyfriend,guilt
i had undertaken to help my sister for her class work but some unexpected circumstances prevented me from doing that,guilt
when they threatened me with a knife to take my money,fear
i was with my girlfriend when some guys that i don't like made fuss at my girl,anger
in a discussion the leader wanted to stop because she was of the opinion that we were not involved and she misjudged our reactions as negative we however only posed several questions which she couldn't answer,anger
when i heard the news of my grandfather's sudden death,sadness
"i was in a restaurant with my boyfriend when i saw my best female friend after not seeing her for two weeks  we rejoyced, hugged and had a long talk",joy
my mother read a letter that a friend of mine had written to me telling me how she had got drunk the last time,anger
"i had made an appointment with a girl to go to the movies, but actually i had no mind when we arrived at the cinema, it was a full house i then went back and she went to the movie alone",guilt
i felt happy when my mother borrowed me the car in order to let me go out alone for the first time,joy
"my mother called me because she had read through the enveloppe a letter addressed to me  she denied having read it intentionally and said ""the words just popped out through the enveloppe as the sun was shining on it"" hah hah",disgust
i received a poor grade on a midterm even though i got all the right answers and knew the material i went to the ta to try to raise my grade and he wouldn't do it,anger
when i was accepted at unza,joy
when on a car journey a fellow student crossed our way with his own car and we had to bump into a roadside trunk,anger
when my grandmother died i had a very deep relation to her (i lived with her for several years),sadness
"feeling helpless, not being able to accomplish what i really wanted to do",guilt
the second time i went to the entrance exam to vsp and didn't get approved,sadness
when a boy whom i refused to be my lover told all his friends that i was his girl he has refused me because i was not faithful to him,disgust
when i spanked a child in anger and later regretted it terribly,guilt
saw the film about eight nations army conquering beijing,shame
when my husband got picked up in our new car for drunken driving we had made a pact the other would not drink and so therefore would be the driver for the evening etc i was not present at the time,anger
"i awoke at night and did not remember dreaming about antthing in particular  i just felt oppressing fear, it was dark and all the others were sleeping",fear
one day i took a packet of sweets from a certain grocery at nathenje then later on i started to feel guilty and realised that i had done a wrong thing to him,guilt
when my library books were overdue and i did not have the money to pay for them,guilt
"someone told me a story of amnesty international: a boy was killed and his head was put in the litter of his girlfriend it looked as if she was pregnant, then she died it is disgusting, i can hardly write it down",disgust
when my wife gave birth to a baby boy - my only son to date,joy
i feel disgusted at people who talk negatively about a person without knowing the person well,disgust
when i read a newspaper article on a young girl who had been raped and assaulted one night by several men when she was unconscious,disgust
i met a friend i had not seen for a long time on the street,joy
i applied for a job of galso counselor and i made the strongest possible application but was denied an interview i felt disgusted at the system which by promoting the cause of minorities makes employing whites lowest priority,disgust
"when i was young, i became very angry as i was not allowed to stay up all night for the fair in my town",anger
i was very scared at the time of the tybsc examination as i had decided to get 1st class results  i was afraid thinking of how the papers would be,fear
"spending the nitht with close friends, after being away (out of nijmegen) for a while",joy
my roommate refused to walk with me to the english lectures i have to walk alone in the dark lectures are in the biology building,fear
about two years ago my girlfriend suggested that we separate  this really gave me a shock as i had never thought that she would say such things  the reason she gave me was that we were not suited for each other,sadness
"when i missed crashing, by a hair's breadth, into a man who came out 20 metres ahead of me when i was driving at 110km/h",fear
"i walked up the main street of auckland at 10 o'clock at night i expected it to be very active with people, gangs, fast cars etc, thought it was actually quite quiet, though also oppressive i walked about half a mile and bought a drink along the w",fear
i did not do the homework that the teacher had asked us to do  i was scolded immediately,shame
when i do or say something inappropriate which hurts people close to me,guilt
"while i was pushing a court roller out of a ditch, i slipped and fell down and the roller rolled back towards me -down slope-it is a miracle that i still have my legs intact",fear
my friend came to see me after she had stayed abroad i waited at the station,joy
i came home one day and discovered that my sister had borrowed my car and had gotten into an accident with it my entire front bumper was destroyed,anger
i felt ashamed of myself the first time i drank as nobody in the family drinks  i felt that i had let down my parents and my friends,shame
the day my teacher of latin and french died,sadness
when i heard that i had made it to the second year at unza,joy
i had just moved to the town where i study and i got a postcard from a good friend (from my home town),joy
"when i asked my classmate to teach me to do my homework, he asked me to study by myself first but i did not do it  when he asked me  if i had studied, i felt very ashamed",shame
every time i went home with my school report,fear
"on reperbahn, in a restaurant, a ""charming"" old saleswoman came to beg a drink for herself",disgust
"i had a quarrel with my father he was depressed, because somebody had treated him injustly as we had an argument, it was impossible for me to help him",guilt
"i had gone to see one of our professors about a book, and i did not  attend the class she took a few minutes laterá",guilt
a girl dropped some stuff from her bag and when i tried to help her i realized that she had used me and i was made to look like a fool,guilt
"while taking a short cut through the vasa park, i was surrounded by three people who tried to steal my money  i was scared and was saved only by the appearance of other people",fear
a person whom i thought to be honest took and spend the little money that i had and i had no way of getting any money in the few following months,disgust
criticized in front of the class,shame
when i saw a wino by some cans with food stamps and use the change to buy wine,disgust
one of my pupils escaped from school to the street,guilt
"one evening i was watching the news on tv again they were talking about the danger of war suddenly i imagined what it might mean for me, for my friends, for the people close to me i felt it a very near and possible event",fear
left alone in the dining hall at night,fear
when the girl with whom i am in love smiles at me,joy
my father and i had an argument because i do not help enough at home,anger
someone had stolen an article from a library journal,disgust
once i did not have enough money to pay for a coffee,shame
finding out that my health condition may be against my attending university lectures,fear
"i feel disgusted at not having got aa ""a"" in yesterday's practicals of g220",disgust
a close acquaintace cried for me i felt happy because somebody cared,joy
when they told me that my grandfather was rather ill,sadness
a situation where i stole a friends wife's wallet,guilt
haven't been frightened for ages,fear
i saved up money for a good purpose as i also have to organise a party i am afraid there will rest only a little money for the good purpose i feel guilty about this,guilt
"at secondary school, one of my classmates lost her locker key  during a class i saw two other classmates holding a key and talking secretly  i do not know why i suspected them, also another classmate supported me  he remembers that these people á",guilt
i was in the library of medical psychology and walked into the wrong direction a man who came out of a room threated me very denigrating and i became very angry in a resisting manner,anger
"i had to undergo an operation in summer and so my family had to stay at home during the holidays  i felt guilty, above all because of my brothers",guilt
when i dreamt that my family was in trouble and was facing many difficulties,fear
"i was the compere at a party and all my efforts to get the show rolling were thwarted by the immobile, non co-operative guests  i felt frustation - bordering on anger",anger
"in 1977, my grandfather, to whom i had a very close relationship, died",sadness
"while tramping on a narrow path two of us were confronted by a woman with two snarling dogs, demanding we get off the property - via a flooded river !",fear
when my sister was born,joy
succeeding in helping others,joy
"when one of my relatives went out at night leaving me and my friend alone, i cheated my parents that she didn't go out, after they had heard that she was out, i was afraid that she might have beaten me",fear
when my brother was held up and robbed,anger
the birth of my child,joy
